video_url,title,caption
https://www.youtube.com/watch?v=Z0AJQamSobI,"김치있으면 ""이렇게"" 해보세요. 누구나 대성공! 칭찬쏟아지는 [돼지등뼈 김치찜]",리아  지금 한 2월 중순쯤 됐거든요 그래서 김장 김치가 잘 익었을 거예요 신맛도 좀 있고요 그래서 그 익은 김치에다 돼지등뼈를 이용해서 김치찜을 만들어 볼게요 돼지 등뼈는 제가 2kg 준비했는데 요거를 제 찬물에 한 시간 이상 푹 이렇게 담 거 갖고 물을 자꾸 이렇게 좀 갈아 주셔야 돼 그래서 핏물을 완전히 이렇게 빼 주시면 됩니다 돼지 등배 잡내를 잡기 위해서  전체를 해야 돼요 전체만 제료 하면은 김치찜 80% 완성된 거예요 그만큼 전처리가 참 중요해요 물 1L 받았습니다 요거 판용 된장에 두 큰 술입니다 그리고 생강 큰 쪽으로 하나 이거 할게 슬라이스 있어요 요걸 넣고 물을 팔팔 끓여 주세요   물이 팔팔 끓어요 그럼 여기다가 돼지 등를 한번 데쳐 주시면 됩니다데 데치는게 바로 데치는게 아니라 끓고 나서 5분까지 데쳐 줄 거예요 여기게  물에 푹 잠기도록 이렇게 안으로 쑥 밀어넣어 주세요  지금은 조 물이 부족한 거 같은데 끓으면서 물이 또 더 올라와요 뚜껑을 덮어 주세요  김이 살짝 나기 시작해서 뚜껑을 을게요  바글바글 이렇게 끓고 있어요 그러면 때 한 번 더 이렇게 잡을 잡기 위해서 소주 한 컵을 부어 줄게요 그리고 지금부터 5분 동안 푹 앱을 삶아 주세요 뚜껑을 열고 삶으시면 됩니다 이렇게 보면  지저분한 기름 같은 거라든가 이렇게 부유물이 많이 떴어요  5분이 지나서 불 끌게요 요거를 이렇게 채반에 건지세요 그리고 요거를 찬물에 한번 깨끗하게 힘들어야 돼요 이렇게 보면 지저분한 거 다 떴죠 이런 거 다 깨끗이 닦아 내야 돼요고 요번에는 뭐를 하냐면  중자에 보면 뼈 사이사이에 런 요런 거 있어요 조금 지저분한 것들 그런 거를 젓갈로 껴 파서 닦아 주시면 잡네 넣고 아주 깨끗합니다 식이다 식트 이거 보니까 깨끗이 닦고 싶지네 [박수] 응 한 세 번 닦는 거죠 처음에 대충 한 번 씻고 중간에 이렇게 사이사이에 닦고 지막으로 한번 헹구 같이 닦아 주시면 됩니다 됐습니다 채반에 걸쳐서 물을  빼 주시면 되고요  아까 삶아낸 냄비에다가 이거를 조리할 텐데 이렇게 냄비 보면이 끝에 이렇게 고기 같은 뭐 찌꺼기 이런 것들이 이렇게 많이 묻어 있어요 이게  깨끗이 안 닦고 하면 비린내가 날 수 있으니까 냄비를 깨끗하게 닦아 주셔야  돼요 깨끗해 그지 일단 물을 저는 3L 넣었는데 그릇이 여유가 되면 한 4L까지 넣으셔도 상관없어요 그 여기 향신채를 넣어야지 이게 잡내를 더 한번 잡을 수 있고 국물도 맛있거든요 런 채망을 하나 준비해 주시면 아주 좋아요이 통후추 한 큰 술입니다 그 제 월개 수입을 한 파에 넣는데 요거는 유 좀해 돼지고기 사면 거의 다 줘요 공짜루이 드시고요 제가 늘을 이렇게 주먹을 한 주먹 넣었어요 근데 늘이  크면 한 열알 뭐 작으면 한 20알도 됩니다 요건 제가 그라스로 포기해 드릴게요 요거  돼지등뼈를 같이 삶아야 되니까요 밑에다 넣어 주세요 그리고 대파 넣어 주시고 되고요 지금은 이 국물이 맛있어야 되니까 지금은 뜨거운데 넣는게 아니라 찬물 상태에서 등뼈 넣으시면 됩니다 이 찬물에 넣어야지 국물이 잘 우러나요이 뚜껑을 열어 놓고 끓이면 한참 끓여야 되니까 일단 뚜껑을 좀 닫아 주세요 팔팔 끓을 때까지 뚜껑 닫아 주세요 불은 강불 있니다 팔팔 끓어요 그래서  불을 약간 중간 불로 줄여 주시고 그다음 뚜껑을 살짝 열어 갖고 은근하게 해서 한 최소 40분 시간 여유가 있으시면 한 한시간 정도 은근하게 끓여 주시면 아주 맛있는 돼지 차골 곡이래요 돼지 등뼈가 삶아지는 동안  김치를 준비할 건데요 김치는 그 양은  취향껏 넣으시면 됩니다 김치를 좋아하시면 뭐 세죠 보통 이쪽이 적당한 거 같아요 근데 이거를 그냥 넣는게 아니라 여기 배추 소가 있잖아 이거 소를 털어내고 넣으시는게 깔끔하고 맛있습니다 그리고  안에 가 좋습니다 나짱 나짱 뜯어질 때까지 하는 건 아니니 아니 그이 정도로 이따가 푹 무르면 흐름 이서 이러면 쑥 떨어져요 그냥  40분이 지났어요 그러고 나서 요 향신채 대파하고 아까 향신채를  건져 주시면 됩니다 국물이 아어서 국물 쫙 아주 국물이 뽀얗지 국물 한번 이게 드셔보세요 지금 진짜 맛있어요이 뼈를 이렇게 한쪽으로 놓고요 물에다가  김치를 넣을 거예요  불을 강불 하시고 아까보다 국물이 좀 많이 줄어서 김치가 푹 잠겨야 되기 때문에 저는 물을 추가하는데 물을 어느 정도 더 추가하면요 김치가 좀 자아이 잠길 때까지 넣으시면 됩니다 아까 처음에 4L 넣으신 분들은 안 하셔도 될 텐데 저는 3L 넣어서 물이 좀 부족했어요요 정도로 넣어 주시면 됩니다 그리고 여기 고춧가루 두 큰수를 넣어 주세요 조금 색깔이 더 고수리 하고 좀 칼칼하고 맛있습니다 그리고 요건 뭐냐면 들 그림입니다 들기름을 넣으면은 김치가 훨씬 더 부드럽고 또 국물도 아주 구수해요 요건 물엿 있데요 물엿도 넣으면 김치가 쫀득쫀득하다 그러나요 수분이 더 잘 빠져 갖고 훨씬 더 이렇게 식감이 좋습니다 그리고 제가 깜빡 잊어 버렸는데 김치국물 한 컵을 넣어야 돼요 김치 국물은 그냥 넣는게 아니라 채에 걸려서이 건지가 없이 구물 맑은 구물 넣으셔야 됩니다 그래야지이 음식이 깔끔해요 고물이래 갖고 요것도 뚜껑 닫고  끓기 시작하면 중불로 끓여 은근하게 김치가 푹 무르도록 익혀 주시면 돼요 이렇게 부글부글 끓어요 그러면 요것도 살짝 렇게 뚜껑을 살짝 열어 놓고 부은 중불로 해서 최소 30분에서 1한시간 사이로 은근하게 줄으면 김치가 그 사골 맛이 확 배 갖고 얼나 맛있는지 몰라요 보들보들 야들야들 해줘요 정말 하는 거는 어렵지 않은데 요게 시간이 좀 걸려서 그래요 맛으로 보장이 다 됩니다 한 수고가 자  제가 한 30분 이렇게 푹 끓였어요 아주 맛있게 푹 이어졌어요 요렇게 해서 맛을 한번 보세요 아주 깊고 맛있는데요 약간 싱거워요 그래서 뭘로 간을 할 거냐면 새우젓 탐 큰술 넣을게요 그리고 요거는 참채 젓 있니다 참젓 한큰술 넣을게요 간은 뭐 참채 액젓이 새우젓이 그가 멸치액젓 본인이 원하시는 거 하시면 됩니다 그리고 또 간을 한번 보시고요 그리고 좀 싱겁다 그러면 때부터는 소금으로 가하시면 됩니다 왜냐면 요게 집집다 김치가 달라요 맛이 좀 짠 집도 있고 좀 싱고 집도 있고 그래요 짠 집은 간게 맞을 거고 조금 심심하다 하면은 간이 좀 부족할 거예요 저는 소금을 요만큼 더 넣을게요 간을 하고 나서 뚜껑을 넣고 또 10분간만 푹 끓여 주시면 됩니다 그러면 간이 더 싹 잘  되겠죠  다 됐어요 너무 먹음직스러워 보이죠 제가 아까 한번 이렇게 국물 떠 보니까 기가 막힙니다  푹 구하지 이게 돼지등뼈 또 깊게 맛이 싹 김치하고 정말 아주 찰도 궁합이고 너무 맛있어요 이게 아무래도 사골 국물이지아요 돼지등뼈 김치 치기보다는 국물맛이 부드럽고요 또이 감자탕 럼 아주 깊은 맛있는 나는 김치찜이 이금 김치 있으신 분들은 꼭 한번 이렇게 해 드세요 정말 맛있습니다 식구들이 모여서 맛있게 드실 수 있는 요리니까 꼭 한번 해서 맛있게 드세요 시청해주셔서  건강하시고 다음 녀석에게 또 만나요 참고로요 돼지 등뼈는 2kg 만  원입니다 m  [박수]
https://www.youtube.com/watch?v=EFHiAVUe9t4,칭찬 쏟아지는 떡국🥇 국물에 '2가지'넣으세요. 찐한 국물에 2그릇 뚝딱!,리아  새 먹는 첫 음식이죠 떡국을 소고기로 더 특별하고 더 맛있게 만들어 볼게요  함께 만들어 볼까요  간단하게 재료 소개부터 할게요 떡국떡 준비했고요 새 첫 날에서  고기로 할 겁니다 고기는 양지 부유를 준비하시면 고기 국물이 진하고 아주 맛있어요  제가 4인분 기준으로 할 거예요 깔끔한 국물을 위해서 고기 핏물을 빼면 좋습니다 고기다 이렇게 물을 벌어서 한 20분 정도만 핏물을 빼 주시면 됩니다  떡을 준비해야 되는데 떡을 인문 기준으로 하는데 요거 밥공기에 크지 않은 밥공기 요거 하나가 1인분으로이 계산하시면 됩니다 그래서 뭐 4인분 하면 요거네 개 넣을게요 요렇게 갖고 요거는 물을 부어 주시면 됩니다 그래서  떡을 끓였을 때 떡이 빨리 보들러 주기도 하고 전기도 빠집니다 이렇게 준비하시면 되고요  20분이 지나서  핏물이 좀 빠졌습니다  고기를 썰게 고기를 썰 때 되도록이면 판판하고 좀 작게 쓰는게 좋아요 왜 그러냐면 그래야 고기 육수가 빨리 우러나와서 국물 끓이는 시간이 좀 줄어들어요 드시기도 좋고요 냄비에 바로 고기를 넣어 주시면 됩니다 그  고기를 밑간을 좀 해야 고기가 맛있습니다 요거 판년 국간장이 한 스푼입니다 그리고 간늘 이거 반 스푼이 저는 참기름을 안 넣을 거예요 참기름을 넣으면 기름이 떠서 좀 실어 갖고 깔끔하게 국 간장하고 늘만 넣습니다 그래 거 조물조물 묻혀 주세요 불을 강불로 켜 주세요 그다음에 고기를 이렇게 살살 묶어 주세요  기 어느 정도 볶아 졌어요 고기 냄새가 이렇게 팍 올라오거든요 그때 후춧가루를 톡톡 한 세 번 정도만 쳐  주세요 근데  물이 이렇게 좀 흥근 잖아요이 고기를 이렇게 보는 거는 요렇게 해야지 고기에 진한 국물이 빨리 우러나와요 농축시키는 거야 지금 이렇게  이렇게 보면 국물이 별로 없죠 요때 물을 넣어 주시면 되는데 물을 이리 채워 넣어 주세요 계속 강입니다 여기까지는 거의 비슷한 방법이고요  제가 조미료 하나도 안 넣고도 감칠 맛이 아주 폭발하도록 진한 육수를 만들어 볼 거예요 뭘 넣을 거냐면 다시를 넣 겁니다 조각 다시 요런 거를 한 일곱 개여 여덟 개에서 막 열 개까지도 괜찮습니다 요걸 지금 넣어 주세요 대파 흰부분 파란 부분 말고 흰부분을 넣을 텐데요 요걸 어떻게 넣냐 그은 것도 그냥 넣으면 국물이 빨리 안 늘어나요 그래서 이렇게 보면 제가 중간중간 칼집을 다 냈어요 이렇게 런 식으로 해지 국물이 빨리 불어납니다 요것도 넣고 지금은  강불로 해 주셔야 돼요 그리고 끓기 시작하면 중불에서 이렇게 뚜껑을 덮고 한 10분간 푹 오려 주세요  10분이 지나서 여기 다시하고 대판 건져낼 거예요 푹 다 우어 놨죠 대파하고 다시 을 너무 또 우려내면 국물이 좀 ubun 그래서 요거는  건져낼 겁니다 제가 아까 그리고 고기 볶을 때 늘 좀 넣었어요 그래서 늘 이렇게 둥둥둥둥 떠다니면 좀 지저분하니까 요것도 요런 체를 이용해서 싹 건지시는 됩니다 요때는 불을 좀 세게 하면 이게 다 떠요 이렇게 그냥 그냥 드셔도 되는데 아무래도 좀 깔끔한게 좋잖아요 요런 거 이렇게 딱 건져내면 깨끗하겠죠 고기까지 건진 거 같지만  고기는 이렇게 또 건져내면 정말 깔끔해요 둥둥 뜨는게 없습니다 그래서  건져낼 걸 다 건져내면 고기만 남았잖아요 요것도 또 불을 또 줄이세요  불을 줄여 갖고 한 15분에서 20분 동안 푹 이려면 정말 맛있는 국물이 되는데 지금이 상태에서 집집다 국물 좀 많이 드시는지 믿고 건너기 위 드시는 집 있어요 건기 위주로 드시는 집은 물을 추가 안 하셔도 되는데 우리 집은 국물을 좀 많이 먹어 그러면 여기다가 물 한 500mm 더 추가하셔도 됩니다  저는 물을 좀 추가할 겁니다 물을 추가할 때는 불을 강불 나셔야 돼요 그리고  끓기 시작하면 아까처럼 중불로 줄인 다음에 20분 동안 푹 우려 내시 됩니다  푹 울어줬으면 뚜껑 열어 볼까요 고기국물 맛이 진하게 아주 그냥 이렇게 퍼지네요 집에 그리고  여기다가 입맛에 맞게 간을 하시면 됩니다 국간장 한 스푼 넣을 거예요 그리고 떠서 한번 맛을 보세요 그리고 부족한 간은  소금을 하시면 됩니다 저는 간수 배 천일염을 사용할 거라서 반 작은 스푼만 넣어 볼게요이 소금 염도는 다르니까 그거는 각자 알맞게 하시면 돼요 약간 싱고 거 같아서 한지만 살짝 넣을게요 그리고 요거는  고기 국물은 끝이 났어요  국물은 다 됐고 떡국에 들어가는 떡을 저 쫄깃쫄깃 하면서 고기 국물은 깔끔하게 하는 방법을 제가 소개시켜 드릴게요 맹물 한 1리를 끓여 주세요 그런 다음에 여기다가 간장 한 스푼을 넣어 주세요 그 소금도 한 반 장은수 정도 넣어 주세요 약간 간이 있으면 됩니다 요 물이 팔팔 끓으면요 떡국을 여기다 넣고 한번 끓여 줄 거예요 요렇게 끓이면 끓이면서 전분기가 쏙 빠져요 그리고 떡이  뭐랄 다 익은 거를 국물에 넣기 때문에 더 퍼지지도 않아요 그래서 고기 국물이 탁하지 않고서 시간 지나면 퍼질 수 있지만 바로 드셨을 때 되게 쫀득쫀득합니다 런 방법으로 하시면 제가요 방법을 해 보니까 너무 좋아서 저도 배운 건데 이게 속 시켜서 드리게 된 거예요 이렇게 보이시나요 벌써 끓이면서 이게 국물이 뿌 였잖아요이 떡에서 전문이 빠져 같고요 요걸 또 언제까지 끓여 주냐이 떡을 르고  끓기 시작해서 한 뭐 1분에서 한 2분 정도 끓여 주세요 그럼 여기서 전분기가 충분히 빠지고 그 간장이요 떡 안에 싹 배 갖고 맛있습니다 떡게 심심하지가 않아요  끓여 졌으면 그거를요 채반에에서 떡을 건져 놓을게요 뜨거 이렇게 해 이렇게 해야 되겠다 그지  국물이이 팔팔 끓어요 저는 이게 지금 보여 주느라고 요렇게 했다 렇게 했다 하는데 집에서는이 옆에  끓이면서 떡도 두 군데다 하시면은 편안해요  국물이 끓지 않아요 그러면이 떡을 여기 바로 다 넣으세요요 떡 자체 하나만 먹어 봐도 떡에 가입에서 아주 맛있어요 그리고 요렇게 끓이면 좋은 장점이 또 뭐냐면 국물이 신고지 않아요 나중에 떡을 르면 떡에서기를 빨아들여 갖고 물이 좀 신고지아요 근데 이거는 처음 맛이랑 똑같아요 그리고 최종적으로  팔을 조금만 넣을게요이 조금만 끓이면 벌써 떡이 동동동동 떠 올라오죠  다 된 거예요  맛있게 됐으니까 예쁘게 떠서 한번 고명 올려 볼게요 떡국 맛있게 드시고 올 한해도 복 많이 받으시고  시청해 주셔서  다음 녀석에 또 만나요
https://www.youtube.com/watch?v=kqiWZ5VZiK8,모두가 감탄한 연말요리. 닭을 '이렇게' 만들면 칭찬이 쏟아져요 [닭봉꿀조림],리아 스입니다 누구나 좋아하는 맛으로 연말 모임에 딱 좋은 닭봉 꿀 조림을 제가 만들어 볼게요 여기 한 팩에 한 400g 정도 되더라고요 그래서 저는 오늘 두 팩을 준비했어요 또 식구들이 그냥 드시려면 한 팩 갖고 부족할 것 같아서요요 닭을 뭐 깨끗하다고 그냥 쓰시는 분들이 있는 거 같은데 요거 그냥 쓰시지 시고 흐르는 물에 한번 깨끗하게 씻쳐 주셔야 돼요 딴데 닦는게요 뼈가 있잖아요요 뼈에 보면 약간  피가 조금 보일 수 있어요 이런 거만 닦아 주시면 돼요 나는 여기다  칼집을 낼 거예요 이게 너무 귀찮다면 안 하셔도 되는데 칼집을 내서 하는 장점은 양념도 잘 배면서 닭이 잘 튀겨져요이 속까지 고루고루 기름이 들어가서 어떻게 하냐면 여기  뼈가 있습니다 뼈하트 여기 경계선 여기기를 칼집 한번 싹 내주면 돼요 칼을 세우고 이렇게 이렇게 한번 런 식으로 내주면 돼요 닭에 비린맛도 잡고 더 맛있어 지도록 밑간을 해 줄게요 양념이 고루고루 닭에 잘 섞도록 하기 위해서는이 다구에 양념을 붙는게 아니라 먼저이 빈그릇에 부어서 같이 섞어 주면 훨씬 더 좋습니다 요거 청주데이트 수복이라는 거예요 그리고 청아 넣으셔도 되고 소 넣 넣으셔도 괜찮습니다 요건 생강 집입니다 요건 소금이요이 천일영 같에 흔드시면 안 돼요 짠 소금은 안 됩니다 보통 염도에 소금을 하시면 돼요 후춧가루 톡톡 한 다섯 번 정도 넣으시면 됩니다 그 소금하고게 잘 녹도록 이렇게 섞어 주세요 그런 다음에 여기다  닭봉을 이렇게 넣고 잘 섞어 주시면 돼요 그 요걸 언제까지 두냐 한 10분 정도해서 20분 정도 사이에 두시 됩니다 맛있는 꿀 양념장을 만들 거예요 물이 좀 들어가는데 여기다 제가 아예 물을 좀 받았습니다 여기 간장이 들어갑니다 양조 간장 진간장 상관없이 사용하셔도 됩니다 그리고 감칠맛을 더해 줄 꿀 굴 소스가 좀 들어가요 꿀이 아니라 고려 그 닭이 또 잡내를 한번 더 잡기 위해서 총 주 좀 들어가요 요거 식초 조금 넣어요 그러면 아주 감칠 맛이납니다 그리고 오늘의 주인공이죠 꿀이 꿀이 들어갑니다 나는 꿀이 없어 그럼 물려 사용하셔도 괜찮아요 올리고당 사용하셔도 괜찮고요 근데 꿀이 맛있죠 꿀이 풍미가 있어서 조금 맛있어요 그래 요거를 잘 저어 주시면 됩니다 꿇고 끓이는 거 아니라고 하시는 분들도 있긴 한데  맛을 위해서 양 공부하세요  투기 못이 안 벗겨지고 잘 붙어 있도록 하는 방법을 제가 알려 드릴게요 여기 꿀팁입니다  튀김가루를 사용하지 않고 제가 전문가를 사용할 겁니다 전문 가루는 여러 가지가 있는데 감자 전문이 바삭하고 좋아요 밑간된 닭봉을 갖다가 탈탈 털어 갖고 이거 간자 전분입자 묻혀 주세요 살짝 충분히 묻히도록 털어서 렇게 놔뒀다가 요거를 20분 동안 두셔야 돼요 그러면 닭 안에서 약간 수분이이 감자 점을 이렇게 빨아 드리면서 튀겨도 벗겨지지 않고 아주 잘 튀겨줍니다 한번 빠른 방법으로 제가 해 볼게요 두 개를 갖고 이렇게 하시면 더 편안해요 제 감자 전보는 한 2분 2컵 사용했습니다 그요 상태로 한 20번만 놔둘게요 아까보다도 벌써 촉촉해졌다 보면 아까보다 다르게 가루라고 안 느낄 정도로 이렇게 착 달라붙어 있죠 이렇게 촉촉하게  기름은 너무 많이 부 필요는 없고 닭봉이 살짝 잠길 정도로만 부으시면 됩니다 불을 켤게요  기름이  뜨거워졌습니다 그러면 지금 제가 닭봉을 하나씩 넣어서 게요 요게 전문가를 묻잖아 그래서 요거를 너무라 하지 세요 조금 거리 두게 해서 요걸 한번 이렇게 뒤집고 이렇게 이렇게 뒤집고 나서 그다음에  안 달라붙어요 그러고 나서 여기다 떠 놓으시면 됩니다 요거 시간은 한 7분에서 8분요 사이로 놓으면은 닭이 완벽하게 죽여줘요  두 번째 튀일 때는 여기  빠글빠글 거품이 올라오죠 요게 없어질 때까지만 조금 기다려 주세요 요게  수분이 다 날라가는 거예요 거품이 거의 없어졌죠 그죠 요때 다시 닭을 넣어 주시면 됩니다 제 프레이 판에 저희가 아까 양념장 해 놓은 걸 넣고 바글바글 끓여 주세요  조림장을 끓을 텐데 늘 한 네알 정도를 제가 납작납작하게 이렇게 썰었습니다 요거랑 같이 보글보글 끓여 주시면 돼요 그럼 여기서 늘 향이 또 나겠죠 요거는  언제까지 냐면 이게  바글바글해 갖고  막 큰 거품이 막 이렇게 몽글몽글 생깁니다 때까지 끓여 주시면 돼요  이렇게 양념장에 박박이 끓 그러면 양념장은 살짝 이렇게 이렇게 떠서 약간 식혀서 한번 맛을 보세요 맛을 봐서 뭐 딴 거는 괜찮은데 나는 뭐 좀 더 달게 먹을 거야 그러면 요때 꿀이라도 물엿을 더 추가하시면 됩니다 제가 왜 이런 말씀을 드리냐면 꿀이 그 당도가 좀 다르더라고요 어느 거는 너무 좀 닿은 것도 있고 어느 거는 조금 덜 다은 것도 있으니까 요거는 본인 식사에 맞춰서 그 단맛은 조절하시면 됩니다  조림장에 바글바글 끓어서 이렇게 큰 방울이 생겼습니다 그러면 요때 아까 저희가 튀여 놓은 닭 을 넣어주세요 불은 강불 내 주시는 거예요 그고 요거를 한번 잘 섞어 주세요 이렇게 섞어서 조림장이 닭봉이 쫙 달라 붙들 도랑 조여 주시면 됩니다음  요렇게 됐죠 그 양념장이 닭이 어느 정도 싹 붙었습니다 그러면요 청양고추 하나랑 제가 홍고추를 하나 넣었어요 맛도 있지만 또 식욕을 도고 와야 게요 그래서 게 나중에 이렇게 넣으신 다음에 한 번만 휘 저어 주시면 돼요 또 언젠 언제 끄는지 궁금하시죠 지금 보면 이게 엿처럼 옆에 막 이렇게 뭐라 그럴까 막 거피 엄청나요 그죠 쫀득쫀득하게요 상태에서 조금만 더 조여 주세요 자 됐습니다 때  꺼 줄 거예요 꺼주고 한번 이렇게 휘게 저어 주세요 그요 상태도 맛있지만 더 식욕이 나도록이 통깨 맵 게만 살짝 뿌려 주세요 이렇게 해서 정말 수제로 해 갖고 이렇게 연말에 같이 식고 대랑 드시면 너무 좋아요 요렇게 하면 4인분 정도는 충분히 드실 수가 있어요 드시기 나름이겠지만  연말에 깔끔하게 맛있게 집에서 해 드시고 좋은 분들과 함께 좋은 시간 보내세요 시청해 주셔서  그리고 요새  너무 추워요 건강히 하시고요  닭집에서 닭 튀일 때 칼집을 이렇게 내더라고 그 왜 그런가 했더니 그래  안에까지 빨리 익어서 여기 안에  피가 그 사이에 고이는 거 같더라고 익으면서 그니까 그게 빠지라고 통자 지감 항상 중간에 이렇게 내 주더라고 과위를 쭉쭉쭉쭉 사이로
