video_url,title,caption
https://www.youtube.com/watch?v=xu71-2Wb_fI,[배고파_이스탄불_EP.09] 누가 이거 먹으러 오자고 했어?,또 해 딱 없다  여기구나 사감 아이란 콜라 난 아이란 너는 아이 아이란 다 아이란 곱배기는 200 리라고 그냥은 리라고가 두 개 들어가요 내 어떻게 나 처음 봤어요 아니 이게 요새 요새 이게 유행인가 봐 원래는 저 알지 저저저 이집션 마자로에서 그 갈라 탑 작으로 다리 넘어가다 좌측에 원래 배에서 파는 고더 케밥이 원래 유명하거든 거기 옛날에 가셨 나 옛날에 갔는데 우와여기 배에서 직접 이렇게 으십니다 어마어마하다 새 들 고등학 해봐습니다 나 옛날에 갔는데 거기가 유명한데 고등을 구서 그냥 우리 바게트 럼 생긴 거 마에다 그냥 넣어 주거든 그러면 자기 알아서 뭐 소스 뿌리든 해서 먹는 건데 요새는 이렇게 라바시고 얇은 얇은 빵 빵이라고 할 수도 있나 저기다가 그리고 저는 양념 원래 안 넣었거든 여기는 이렇게 해 갖고 또 더 구자 한 번 더 양념 다 해주네 여기는 진화된 형태네 요새 이게 유행이라는데 먹어봐야지 온김에도 엄청 맛있 저거 하나 올리브유 하나 레몬 하나는 성류 이걸 걸 뭐 뻔히 먹는 거는 그다음에 소금 그다음에 오레가노 그다음에 큐민 맛은 있겠다 맛 있겠다 고등 비린거 못먹 사람은 이게 낫겠다 두개 먹을까 우리 일곱 개 시켰지 우리 일곱 개 시켰죠 일곱 개 저 가시가 없 가시 발라내는 거야 데씨 그게 복걸 보이야 저렇게 발라 내도 가이 있는 사람은 그 알잖아 엄마가 그렇게 발라줘도 결국 가이 먹게 되는 사람 가시 먹게 되더라고 그 그거는 우 시게 확   당기는데  Ah  he  냄새만 맡으면 그 부산에 가면 그 고등어 고갈비 골목 있잖아 야 밥 먹고 싶다 고등어 자아 냄새 나니까 밥 먹고 싶다 이게 낯설지 않는 냄새 때문에이이 침 나온다 맨 먼저 나오는거 내가 먼저 먹을테니까 너들 차례대로  먹어    아이란 야 아이란도 백다방 팔아볼까 안 사 먹을 걸 요구르트 음료라고 그러면 다 짭짤하다고 생각 안 할 거야 다 잘찍어 할 거라고 생각 이건 아이라의 특징은 짭짤한 거잖아 맞아 낯설지 맛들리면 중국성 있어 야 저쪽 배에서 파는 거에 비해서 손이 되게 많이 가게 하네 진짜 정성것 까시 발라내고 껍질까지 벗겨 내네 껍질에서 약간 약간 비린내  나거든 우리 일곱 개 시켰지이이 사람들네 개가 다섯 개  시키고 땡큐 야 한참 기다렸네일부러 양념도 밖에 발라서 었구나 이러면 양념이 살짝 물면서 향이 더 세지는데 아까 일곱 개 시켰나 씨 하나 더  시킬걸  달라요 맥이 달라요 전혀 달라에다가 넣어서 파는 보등어 케밥이 그냥 소공 구라면 이건 양념구이 예를 들어서 이거 안 먹었으면 후할  뻔했다 하요먹 안 먹안 먹는 사람 있어요 신바다 거 맛나요 나지 근데 세게 나지 나아 양념을 해다 뿌리고 밖에도  야 하나도 배는 충분히 부는구나 배는 불러 나 아까 먹을 때는 한입 먹을 때 되게 부족할 줄 알았는데 양이 작은 양은 아니냐 한 다  들어 너무 착하다 들이요 방이라서 배다나도 모르게 두 개 먹고 있네 대부다 이건 가면서 먹으면   되겠다네
https://www.youtube.com/watch?v=J8TVPuXAu18,[내꺼내먹_EP.11] 어머니 손맛이 그리웠다구요! 아낌없이 내어주는 원주 골목식당 | 어머니손칼국수,오늘 원주를 왔습니다 원주 칼국수 먹으러 가는 솔직히 그집 칼국수 되게  생각나 막 육수 끓이고 있 타이밍이는데 보세요네 아이고 사님 네 저 저예요 예 백종원이 어마 어마 그지 어머 어마 어마 잘 지내요대편 잘 지내세요 건강하시죠 저야 아이 나야 근데 사장님 건강은 어떠세요 나 이제 아픈데만 많아져 아이고 그럼 안되지 몸고 한번 제가 주만 들릴게요 팬님 완제 오실 거야 글쎄 뭐 겨울 가기 전에 그 팥죽 먹으러 가야지 뭐 맞아 팥죽 꼭 잡으러 오셔야 알았습니다 건강 잘 챙기세요 서프라이즈서프라이즈가 맞겠구나 가서 도착하면 조은 선생님 오셨네  먹고 나왔는데 어디서요 저버스 카 하셨다고 사장님이 막 지금 들어오시면서 나나 나 여기 온지 모르거든진짜  차차 어머 안녕하 어머 안녕하세 만 마 마 손 손님 계시 어머나 아니 옆아  뭐 이렇게 일찍 장사 셨 아니 옆에 오셔서 장난친 거예요그  아유 어떻게 하면 좋아 잘 지냈어요네 장난 친구지 더 젊어지신 거 같은데똑같지요 뭐 별일 없어어 어네 이쁘게 나오 입고 나올 걸 자연스러운게 신나요팥죽을 먹고 칼국수 먹을까 아니 아니 칼국수 터 먹어요 다 드릴게 다 잡 칼부터 왜 떡이 이거 또 아들 집에서 갖고져 매일 먹으라고 이렇게 나 떡 해 놓을까 봐 전 안 하 안 하고 는다고 그랬던 건데 아니야 이건 매일 이렇게 갖다 줘 먹으라 아님 아직도 떡집 잘돼요 예 예는 줄 알아떡을 또 주면 안 되니까 내그래도 조금씩 하나씩만 주 떡 먹으면 칼국수를 막 먹을 수 있어요 그래도 왜냐면 아들님이 떡지 하잖아 그래서 매일 드시라고 떡 해보자 여기 가서 과일 좀 조금 사 아지마 왜만 싫어 싫어 싫 아니 진짜로 진짜로 과일 원래 과일을 별로 안 좋아해요 진짜     고음 국물 좋나 야이 맛이지 맛있어요 맛있 맛있대 대표님이 맛있대 육수 맛있네 역시 괜찮아요 육수도 맛있고 국수도 맛있고 어머 아이 국물 맛있어 그 이게 칼국수가 손칼국수 만에 특한 식감이 있어  아유 또이 할머 보고 싶어 한다고 또 오신 거봐 얼굴 겸사겸사 겸사겸사해서 왔어요 아유 그러셨구나 또 알아보니까 시장도 손님이 많이 떨어졌다고 그래서 많이 떨어진 정도가 아니야 그래서 그러잖아 그러는 사람들 많아 대표님 좀 한번 오시라 그랬으면 좋겠대 도와야죠지역에 도움이 되게 해야 돼새 엄 너무 좋아 나를 살려 주셨어 대표님이 진짜 뭐 잘래요진짜야 나 그때 엄청 힘들을 때가 진짜 힘들을 땐데 그게 인이지 진짜 살 그 마지막 검사받으러언제 아직도 한 1년 1년 1년 정도지나 완치 판정받는 거죠 예 그때 돼요 완치 판정받아 얼마나 다행이에요 아이고 이젠 한이 없어 내 내일 가도 괜찮아 먼저 또 저기 생생 정부에서 와서 해래 그때 막 힘들 텐데 그래서이것도 했다 대표님한테 누가 될 거 아닐까 그렇지 체력만 되지 리 일해야지 뭐 건강하지 진짜가 진짜 진짜 젊어요 아닌데 골고 하는데 바쁘면 젊어져요 수는 말이 필요 없어 이제 팥죽 하나 주세요네     김성주 씨가 좋아하시는데 김성주 씨가 김성주 씨 진짜 좋아하지 아주 설탕을 뒤다 타가지고 누 마시지 이제 먹으면서 계속 고민하는게 두 상태로 계속 김치랑 살살 반찬 먹듯이 먹을 거냐 설탕을 넣어서 디저트처럼 먹을  거니 이게 나는 사실 달콤한 거 좋아하거든 근데 여기 팥죽은 해 진짜로 대표님 설탕 타실 거예네 별로 안 좋아하시면 설탕 별로 안 안 넣고  다음 안녕히 가세요  대표님 뭐 하나 물어볼까 넷째 잘못된 거야 말도 안 되는 소리 그러니까 그 요새 어제도 어디 갔는데 넷째 자리냐 그러 왜 강아지 백이 이름이도 왜냐 백술 도가고 양주장 이름 백술 도가니까지 전 놨는데 한번은 데리고 내려가서 걔를 보여준 거예 그러면서 너네 막내 동생이야 내가 그랬거든그래서 그러 소 강아지를 그 내 우 소 소리지 했더니 나보고 응 저기 뭐야 로또 1등이 됐대 내 평생을 살면서 로또 10원짜리 다나 사은 적이 없거든 아이 1등이 돼 가지고 내가 대표님이 얘기하지 말라 그랬대 아이 있으라 그랬대 그 소리는 왜 나오냐고머님 참 희하 그참 그러면서 가게를 팔려고 가게도 내놓고 나오지도 않고만 뭐 그랬다고 혹시 된 거 아니야 나 그대로 기원도 안 갖고 다내놔 사람들이 시세 하는 거야 아주 생각보다 이거 팔 죽이 너무 잘했음맛있 내가 그때 야 이거 맛있어서 될 거야 내가 딱 그랬거든 근데 홈쇼핑 회사에서는될까요 그랬다는 거야 팥죽을 별로 안 좋아하는 내가 가끔 생각날 정도면 무조건 돼요 내가 딱 그럴거 맛 그 만만 그대로 대량으로 만들었을 때 맛이 재현되면 그래서 이거 재현하 애 먹을지  묵 쓰는 거하고 파죽 쓰는게 제일 힘든 거예요 맞 배좀 하나 배 아니 아니 안 먹어 나 나가야 돼 저저저 저저 이제 돌아다니면서 저기 해주 올라 여기 아니 아니 안 먹어 싫어 그럼 커피 아니 아니야 왜냐면 이제 여기 돌아다니면서 사진도 좀 찍어 주 가려고 나 국수 하나 더 줘요 이거 국수 갖고 가시게 그럼 팥죽도 팥죽도 여기 거 한 두 개 주고 팥죽도 두 개 세 개도  아예 이거 3인분에 만하면 너무 싼데 아니야 괜찮아 근데 응 이게 빨리 변질이 돼국수가 응 집에서그러니까 그걸 해야지이걸 저희가 개발팀 붙어 갖고 연구를 해 드릴게요 오 할 수 있게 그런 건 할 줄 모르니까 해 줄게요 저 저 죽처럼 만들어 드릴게 차 계산 아이씨아유 그런 거 없어 아이 오만로또 됐나 보다 싫 또 시끄이 이거 안 돼이 이런 복 떨어져이 복돌을 받아야 되는 거지이러면 안 돼 이런 떨어져요 싫어 떨어져도 이젠 괜찮아 그지 그 말도 안 돼 저어 안 된다니까 아이 나중에 놀도 되면 다 돈 죽여요싫어 안 돼안 돼 안이거이 그거 자꾸 말리니까 끝내는 거잖아요 더 꺼내라는 얘기 밖 안 들려요 됐어 이제 그 꺼내 또 또그럼 또 꺼내야지 또 꺼내 아니 아니 아니 자꾸 얘기하면 더 꺼내야 더 없어 다 떨어졌어 이제이 통 여름 여름 되기 전에 한번 올게요네 진 애들 들리고 한번 와야 되는데 엄마 그럼 얼마나 좋아 그거 고생들 하세요 예세요 예 지  영광입니다 마 아이고 세상에가 잘 챙기  알았어요너무 반가웠지 아니 며칠 있다 오신다는 분이 꿈같이 나타나잖아 오시는 줄도 몰랐는데 행복한 거야 하여튼 그저 우리 손님들은 오시면은 잘 먹었습니다 그 그게 아니고 아주 조그만 애들도 할머니 건강하세요 그러면서 할머니 국소 최고예요 그러면서 그게 제일 고마워요 항상 우리 집 찾아 주시는 모든 손님들 그자 건강하시고 하시는 일 잘 되시고 그것만 바해 여는거나 바르는 거 하나도  없어 h
https://www.youtube.com/watch?v=k5Ntj4_4pFk,'100종원의 하루' 이모티콘 2탄 출시 임박! 많관부! #shorts #백종원,별일 없냐 밖으로 이전하는 준비는 어떻게 돼 가냐 뭐 잘하고 있네 그리 여기 이모티콘 잘 만든 거 같아 그리요 근데 고생한다이거 고생했다 이런 이모티콘 있으면 좋은데 고생했어 고생했어 이런 거 내가 제일 많이 쓰는게 그리어 따봉 그 쟤 뭐 하냐 빙빙 버퍼링 도는 거 내가 되게 좋아하는 건데 근데 사실 필요한 거 많잖아 우리 추가적으로 더 만들어야 돼 이거 은근히 내 이모티콘 와이프 많이 쓰거든 그까 따라하면 안 되는데 그다음에 이모티콘 같은 경우는 아이디어 있거나 혹시 원하는 이모티콘 있으면 더 제작해서 2차에 넣은 3차에 넣은 더 넣는 거로 오케이이런 거 오케이 이거 있던가이거 있다 이거 괜  있다
https://www.youtube.com/watch?v=Kj3iNd_RmQ0,[백종원의 님아 그 시장을 가오_EP.43_포항] 내 동생 진이가 알려준 바로 그것!,오늘 우리 지역에 강한 바람이 풀고 있으니 외출자제 너커 주의 무슨 악귀라 악귀 중에 하나냐 먹는데 걸신 등이  악귀추워 팀원 여러분   오늘 무지하게 춥네 아까 괜찮았는데 얼마나 추면 저 갈매기들 봐 갈매기들 안 움직이는 쟤들 원래 방장 맞은 애들인데 쟤들 그대로 있잖아 가만히 많이 춥습니다 여기 되게 이쁘죠 근데 이쁘죠 여기 많이 와 보셨을 건데 저도 많이 와봤는데 이렇게이 이런데도 있었구나  여기에 그 많이 다녀봐야 돼요 저도 여기 되게 많이 왔는데 여기 어디냐고 아직 안 알려줘요 추운데 예 이쁘긴 합니다 추우니까 배 배도 고프고 바람이 바닷바람이 보니까 눈물 나나요여기 힌트 과메기도 많이 드셨어요 여기 포이에 포항   예  야 이렇게 추운데 있다가 가면 확실히 맛있어 그렇지 이래 놓고 무에 먹는 거 아니냐 들 내가 물레를 좋아하는데 오늘 무에 먹을손시려 가자 밥 먹어러 어우이 딱 간판이 있어 보이는데 상골 보니까 딱 알겠다 메뉴가 뭔지 그지 바다에 갔으니까 또 해물을 응 신발를 벗고다 장사하세요 예 장사해요 예 으차차 몇 명이세요 여덟 명이요 여덟 명 예 방으로 이야기해 놨다는데얘야 사람가씩 아니 닮았어요 맞는데요 아니 신데맞아요왜 왜지 아이 소개 받고 왔지 아이고 우리 그냥 추리하게 그냥 출연한지 아닌지 먹어보면 알겠지 뭐 차차차차  짠 아구찜 해물찜 저희 그러면 사장님 아구찜을 대자로 두 개 주시면 좋겠는데대짜 두 개 예약 있던데그래요예약 알아서 했어 참 근데 매운 맛을 좀 이렇게 고르실 수 있어서요 야 보통 매운 맛약간 매운 맛 그래야지 않을까데에 엊그저께 종감 사람게 위장을 너무 혹사하고 있다고딴데 다 좋은데 위장을 너무 혹사한 다는데 장약 열심히 먹고 있었는데 첫 번째 반찬 이거요네 초대방 미쳤어요  아이고 아구가 예를 들어서 그 무슨 악귀랑 악귀 중에 하나야 먹는데 훨씬 든이 악귀 그래서  아귀 못생긴 생선 거의 랭킹 안에서 들어갈 걸 아구 삼숙이 물매기 다 못생긴 것들이 맛있어요 안 안 먹는 생선이 안 먹는 생선 저쪽 인천 쪽이나 물텀벙이 그러잖아 물에다 집어 던져 갖고 벙벙 물텀벙 그랬었는데 그게 이제 마산 쪽에서 길에 널린게 구니까 반쯤 버려서 말린 거를 갖다 가지고 좀 해달라고 그래서 해서 먹었는데맛있더라는 거야 원래 아구찜의 원조는 마사란 썰이 제일 강력한데 정 마 사람들은 방 고 그 산 부 생 우 생 먹 먹 거 그리고 아구는 우리만 먹는게 아니라 외국에서도 많이 먹는 생선 아구 살이 생각보다 살이 두툼해요 큰 아구는 그래서 아구 스테이크 많이 하잖아 그 생선 요리에 많이 쓰고 까꿍 뭐래요 미역국입니다미역국 미역국이 색깔이 보였네들게 미역 국이네 예 예  좋다 어우 시 확 도는데  차 많이 주시는구나 개꿀인데 그런 단어는 누가 알려주시는 거야요개꿀 진이한테 배웠는데 진이가 제일 잘 쓰는 말 중에 하나잖아 그것도 진짜 잘 없는 응 물귀  k 짝 잘하시네요 내가 봤을 주먹이로 막 대충 대충 해도 그 맛 같아요 제가 원래 남 먹이고 이런 걸 좋아해요 나누는 걸 손이 큰 거를 하면 아니까 이야기해도 안 돼 도 제일 좋은 거 무조건 써요 음식 좋아하니까 하는 거지  음식 알아 포항 시금치 명한 거 바닷바람 맞은 시금치 야 약간 기대된다요 밑반찬 솜씨가  감합음 못  어해   Ye 좋다 야 아고 신선하다 이게 보통은 이렇게 해서 한입 먹은 다음에 양념장이대 잃으면 평범한 건데 아구가 좋다 너들은 아구 집에 맥주라 먹냐 소주 먹냐 전 먹게 진짜 소맥 폭탄주 잘 타는 사람들이 보면 보통 소주를 조금 넣어 그리고 양을 조금 이러면 사랑받아 뭐 사랑받 폭탄면 사랑받을 일이 야 맛있게  먹자네 양님이 맛있으니까 마물이 많아도 좋아 약간 매운맛이 내입엔 딱 맞네음내장도 들어 있네 아구이 원래 내장 들어가요 응 응 아가 신선하니까 내장 쓰지 응 너 위 먹어 봐 거 맛있어 차살가족 외시 거 같다 아버지랑 아침 잘하는데 진짜 생각보다 드물어요 그 아구찜이 맛있다 그러면 좀 우리 입에는 좀 양념을 강하게 해주거나 신선한 걸  쓰거나 콩나물이 좀 통통한 거 같아 잘 살면서 그래 아구찜에 들어가는 콩나물이 별가 아인 거 같아도 오래 삶고 덜 삶고 참이 아니야이 잘못 삶으면 즐거 질검 거려 너무 들 삶으면 콩나물 비린내 올라오고 사모님이 솜씨가 있으시구나이 정도 하고지면 반찬 공기밥이랑 먹어도 맛있을 것 같아 리는 국수가 있고 라면사리가 있습니다국수 사리도 있어요 국수사리 하나만 국수사리를 안 먹고 밥을 먹기에는 너무    아쉽지요  음도 국 한  시켜야겠다 양님 밥 볶는 거보다 밥이랑 하주 먹 훨씬 낫겠어 장 공기밥도 하나  주세요  밥을 볶을 필요가 없구나음 국수도 맛있고 그냥 하얀 밥이랑만 먹어도 맛있고 불라배 보니까 아무 생각없다 사님 잘  먹습니다을 한개를 팔아도 제일 제가 최선을 다하고 모든 사람이 행복해야 나도 행복해 있더라 처음 시작과 마지막이 될  거예요
