video_url,title,caption
https://www.youtube.com/watch?v=nmycKTOEbP8,집에서도 갈비집맛을 그대로! 돼지갈비양념 | 돼지갈비구이 황금레시피 | 파절이 만드는법 | 석쇠돼지구이 | 어린이반찬 | 파무침 만들기 | 파무침 레시피 | 돼지갈비 만드는 법,으 어느 요즘 노트 8 역의 그 5 으 core i5 으  2  돼지 값 양념을 하고 삽니다 아 저희가 어디지 가지를 집에서 이렇게 초를 떠서 하게 힘들잖아요 그럼 어 돼지고기 목심 구애를 준비했어요 1 600g 이구요  피부를 이렇게 좀 제거해주기 위해서 키친타월에 하고 요리도 눌러서 헹굴 음 제거 해 주겠습니다  그리고 고기를 그냥 아 그게 아니라 으 돼지갈비 집에 가면 한 고기의 칼질이 들어 같잖아 이것도 쪽 할지도 될 거에요 어떻게 주로 내면은 요런 노라죠 이렇게 이렇게 끌어 줘야 돼요  그런 식으로 하고 욕도 로부터 뒤 같잖아요 이런 숏 을 쓰고 그냥 받는데 이쪽은 식도 5 오오오  이렇게 보시면 요렇게 저서 앞 제가 칼치기 낫죠 양념이 잘된 자 지구 들어줍니다 아 한번 좀 심해 주겠다 outer 으 이선주 그랬으면 틀리고 줘 반대쪽 이렇게 퍼드 갸루 끊어지기 때문에 불러 개체 회장님들 개 보여요 중심으로 note  고기 뺏고 잠에 양념이 이런식으로 들어 갈 건데요 배 양파 럼 많은 생각을 이렇게 들어갈 건데 이걸  나머지 가을 되잖아요 그래서 좀 으 222 아 222 어 제라 양파는 나 중앙 크기로 1 답을 au 정도 넣었는데 뭐 적당히 지배하는가 협상이 드셔도 괜찮아요 4 간장 설탕 맛이 주향 모두 조금 5 5 아직 다 좋고 그래서 좀 으  으 아 생생한  드시면 돼요 거지 3 그래서 좀 그랬는지 아 말은 한 스푼 정도 날림으로 으 오늘 게 지갑에 들어 갈 것은  콜라 인데 콜라를 내며 저항 어 연육 짝 영어를 할수록 자꾸 뭐라고 으 많이 양념도 잘 측도 되기 때문에 콜 a 에 총 세 컵 들어간 일단 한컴 녹 알겠습니다  note 으  으 으 으 그렇게 조금 더 날까요 222 모든 야채를 누굴 게다가 르쳐 않아요  지모  콜러 3쿼터 들어 거야 아까 한 컵을 여기에다 놓을 때 갈증 커버 여자도 헹구는 헹궈서  으 악 이렇게  4 입주민 들어가 계신 같아요 600g 생각 들어가요 제가 예전 못 되고 많이 해 먹었는데 정말 맛있어요  4 간장을 임했는데 간장은  * 숲은 6자 에요 물론 좀 쓸게 5 으 네 설탕은 5 철 교수 품 안 될 거에요 플라이 장기가 있기 때문에 그가 내게 딱 맞아야 하고 후 추후 9 춘 적당히 으 주시고 그 다음에 참 김 이하 스푼 들어갈 거에요 222  으 oo 야 먹고 있습니다 으 으 으 나란 놈 으 오오오 다음 적당한 거 참 맛있어요 4 40 소질 용골 갖다 놓게 해야되나요 주식 될 거에요 그랬던게 수병 과장의 8시간 이어도 거쳐야 되요 그러면 정말 맛있어요 닦아 특성 어사 목록 알 수 있지 않습니다 좀 ye 제가요 lee 먼저 해 놓은 2 가 1일 숙성된 거라면 보여드릴게요 이게 이렇게 수용되는 고기 잖아요 이렇게 너 건 있었죠 지금 이거 네 이렇게 재빨 거 찮 아 요 여기 후퇴한 것은 요걸 워낙 많이 많이 차이 해주죠 쉽게 임하길 안되는 잘 되서 이렇게 맛있어 진양 남 이거든요 쫌 2타 모코 제가 타 추도 같이 해서 보여드리겠습니다 하체는 조금 길게 파악을 하셔야 이렇게 3 4 것이고 으 지원이 안 시중에 태가 나와 있긴 하다 라고 했는지 이쪽에서 사과 짧게 지금 생각하신 조건 테러 가운데 심한 뺏어서 멋지게 나 이런데 이용하시고  너를 2번 이는 헤븐 양도 접으려 받고 이렇게 곱해서 하시는데 no 탁 칼이 끝까지 잘 들어가네요 그렇지 못해서 이렇게 물에 요런 쪽으로 딴걸 없네요 단걸 오면은 말이 맞죠 빠지면서 파츠가 점심으로 사랑하죠 아 그거 지금 이런 # 하시면 되요 제가 먼저 이렇게 써야만 보여드릴게요 뭐 조금전에 아까 틀어놓은 파티 인데 이렇게 보시면 이렇게 피가 있죠 야림 몰드 빠지고  모래 건져서 물기 뺀 남의 제가 양념을 하겠습니다 불나게 태워줄까 아 타 묻길래 빠지도록 기다리고 이렇게 브리또 40만원 그러니까 약간 나중에 이렇게 치킨 탐험을 살짝 빼 놓으면 더 좋아요 야 가능하겠어요 음 정확한 레시피는 어때요 이렇게 간장 3스푼 정도 놓고요  그 다음엔 살짝 하냐고 들려도 많구요  5 아 그 다음에  식초 1숟갈 오브 그런것 예 556 2 구매 약간 쌀짝 날것 실패 거 같은데 아님 할수록 보내드린 따려고 고추 카드도 베이직하게 계시면 되요 으 좀 그렇죠 서버 카드 알수록 느끼시는 분 으 note 으 아 으 냄새가 참 생 교통편리 겠구나 는 toz 이럴 때는 프라이팬에 한데 고비를 놓고 5 좋겠읍니다 으 고기를 게 꽉차게 놓고 보이지만 여기에 얀 연장의 눌러 부작 잘 보셔요 그 천에 저버릴 때 주말 토크 프로 누워서 중 풀로 2 나의 흑발이 있도록 했습니다 혹시 잘 별이 있는 제품 자율로 코드 괜찮 저희 주고 자기가 된다면 오느라고 되면 벗어 보여드리겠습니다 그럼 을 땐 부르다가 요즘도 중간정도 뿐 요정 돌에서 2가지 속까지 잘 익어요  고기가 익었는지 확인 하시려면 고기로 높여봤자 낯설 게 보시면 면이 다 읽었죠 이때는 풀어  박 높이 셔서 쪼리 듯이 에서 빠 싸이키 시면 되요 그리고 제가 하나 더  같아 드리라고 하는 것은 4곳 고개가 달 같잖아요 근데 이게 약간 숲을 말씀을 내고 10 내가 2부 드시고 싶잖아요 그런데 그 수 플러스는 없지만 이  까 투도 떨어 초 5  5 아 어느 아 요 정도 뛰었어요 이렇게 4 5 열심 불 맛이 나요 고향 여장부 더 기름 부터 쭉 잘 빠졌어 맛있어요 특히 이렇게 장악하는 자가 써서 포토스토리 3 예  빵님 예 살짝  요통 양념이 많은 것 같아요 칸 없다 닦았습니다 맛 으  으 으 고기 보시면 아까 이거는 제가 진척 3 2장 이렇게 2 글을 같이 한거고 이건  플라톤에 따르지 한국어 든요  4 ae  tel 아 디 발표할 충 되었습니다만 감사 메달  으 myo 으 으
https://www.youtube.com/watch?v=E_uanMvbFSg,더운 여름에 입맛돌아오게하는 찌개 | 야채&고기의 깊은맛과 칼칼한맛이 매력적인 돼지고기야채 고추장찌개,아 태 우 적으로 가능하게 좀 하세요  으 이 페즈 보기 양식 꽃이 울 닥치게 간다고 하는데 먼저 치료 들이 이렇게 소개와 되는데요 못할 테지 고갱을 뭐 이 딴 썰매와 함께 줄에 쓰려면 아 아니 그렇게 끔찍하게 썰어주세요 5  6:30 핀란드의 6층 될 일 콥 정도 된다는데 요런 다시 팩으로 오겠습니다 먼저 제조 봄 꽃 빠졌고 왜  the a  222 뭐니 가르쳐 보류하기로 생각이에요 2 기자 아 뭐야 우리가 관여할 겟 됐냐 아니라 도록 충무로 폭발적으로 시작할 거죠 으   는 타지 않고 음 소스를 넣어 가 된다 4  으 아 아무래도 아치는 빨리 있잖아요 제 보기는 묵인 모디 롤 알지만 힘드니까 어느 넘어오는 되게 총 10곡 정도 1 걱정도 들어갈 때는 핫초코 털어서 먼저 했어요 꿀이 들어간 여성의 4 그동안 야채를 좀 준비할 거에요 으 으 큼직하게 이렇게 잠시후 좀 아쉽네요 아 아 모든 썰 썰어서 전분이 나오면 은 찌개 가지 탑 답해 되니까 이렇게 무대도 잡아 모르겠음 해서요  굉장히 큼직하게 예 아 아 예 한거 아 아 음악도 좀 아 감 앞에 끌려가 굉장히 총 피자 쪼끔 들어갈까 볼까  땅 땅 복잡계 가고 평판 내가 좋아 아 아 아 아 박찬 탓 유비 되었습니다 고기가 충분히 자리고 맘도 자루를 해봐야 제일 먼저 함께 가능 감자나 좀 읽는 시간 좀 다르잖아요 간다 놓고 나중에 너무 빨리 라더라 오징어 지겠습니다 [박수] 222 [박수] 아 전문 나까지 되겠지만 다 이 아 부어 덧셈 있거든요 단 맛이 합니까 아 [박수] note 으 아주아주 그리고 잘 있나요 아 아 오오오 채우 점수로 어떻게 가능하겠죠 잘 파악하도록 아 개조개 다 뽑아 볼 만한 채워줬다 시 말을 잘 아는 거예요 꼬 그래요 [박수] 아아아 아 색각하지 나오는 거죠 아 [박수] 으 드리겟습니다 아 혹시 쉬고 오세요 해줘서 또 커 출하 시기 라는 소금 좀 수 맛있게 잘 간략하게 넣으시면 한테 너무 2번 취향 딱히 내 두 볼을 의미하는 공모 대학가 탑재하는 띠가 있겠다 2 남 추천을 안 해주고 싶었거든요 4  돼지 고기 고기 서약 채 지게를 완성되었답니다 잉 땅 풍경 note 아 아 아 아 으 to
https://www.youtube.com/watch?v=CCHuEsVk1rY,"도시락반찬, 맥주안주로도 OK👍맛있는 소세지 야채볶음(쏘야볶음) | 소세지야채볶음 황금레시피",아  222 으 으 me2 아 으 으  또 스시야 치고 빨라 오를까요 말세 해물 그냥 큰 원한 껌을 한번 재미있는 3 퇴출에 떨어 나 그런거 가족 할껀데 먼저 어느 계획할 개봉 이렇게 해 주셔야지 소개는 요런식으로 활 찜을 해 주신 거예요 으 놈 맵이 하셨어요 여러 구요 그럼 좀 5  야채를 쓸 뻔 태아 층은 저는 요렇게 준비했는데 없고 5 집에 있는걸 사용하셔도 되요 no 아 아 아 사양 색깔 대교에서 이렇게 메테오 이 꽃이 넘 생 핀 않으셔서 해 보여요 으 222  으 아 아 둬 주세요  으  싸 복된 답장 빨라서 편만 오른쪽 들었던것 같아요 인사 많은 클람 물에 소세지를 갖다가 해줘야 기가 빠르면서 여기 향 각하 같죠 묵도 좀 맞을 것 같아요 팀 등 정말 굉장했습니다   공연을 할 때 이 양념을 먼저 준비해서 관련 하네요  단자나  검사 탈락시키고 쭉 뭐람 에 애착을 엑스트라 할 거에요  으 으  으 으 ge 를 봐야 돼 날  도중 분의 1 물론 진압에 좀 낫다 많은 슬어 한 말씀 더 올려 기름을 내겠습니다 코트 퓨 통과 들으시려면 그만 없다면 단맛을 이렇게 잡습니다 아 아 아  으 좀 yet you  아 으 4 5  wee  으  ter 뭐 소설 지나 야채를 이용해서 한번 맨 들어오네요 3 치안 체 머무 않나 되었습니다 희창이 주셔서
https://www.youtube.com/watch?v=0EajZtCK2QU,여름보양식 - 삼계탕 | 녹두와 찹쌀을 넣은 훌륭한 한끼 보양식,행동도 정해놓고 말았구나 5  5 5 peer-to-peer 5 으  뭐 보내 를 초복을 앞두고 행거 탐 허락합니다 4 아기 2리 2 닭 이처럼 예 에도 낸 거 한  리 아 1 500 미끄럼 정도 되는 야매 두 리 양을 감복하게 주네요 먼저 닦아 건조 못하겠습니다  하고 싶네요 요거트에 나에게도 으 모모 요거트에 랙 기름 굉장히 만큼은 야 이걸 만나야 돼 손질을 해 보도록 하겠습니다  outer 됐거든요 으 5kg 기름 덩어리가 되는건지 제거해 주셔야 되요 노무비 랗게 보면은 그런 기름 보기 드렸잖아요 껍데기 라는 뜻이고요 안에 기름 붙은거  보시죠 요런거 좀 제거해 주시구요 그리고 이 아내 보면 예 보이게 없느냐는 피떡 같은거 있잖아요 이런걸 잘 제거해 주셔야 될 때 깐 판례를 게임 이게 남아있으면 음식을 했을 때 비린내가 나요 pb 진행할지 브랜드 아이 걸 굉장히 검게 카시 이 닦아 주셔야 되요 이 딱 받겠습니다 [박수] thou 크기 좀 되게 고소영 잎이 긴 2회말 떨어져 전사했고 이런걸 다 깨끗이 재무 취해질 너무도 잘 알 텐데 안 그놈들을 100밧 좀 부탁 같더라고요 4 감사 or 5 아 깨끗하다 끝이 없군요 왜 굉장히 맞대 갑니다 아 삭제를 하셔야 되요 어 아 * 깨끗이 손질해 놓고 제가 들어가는 재료 4 이거든요 1개인 3곳 아득해 참 영웅 많으 쭈 단기 문의 이럴 때 이거 없으시면 다 않으셔도 되겠네요 근데 먼저 내 탁  나중에 다음 늦기 전에 환기에 물은 먼저 내는게 좋아요 이게 양이 1기를 먼저 올 한판이 터라 도는 구석 어쩜 부 2 1 부모를 올리도록 하겠습니다 황기의 1 50g 정도는 양의 한 10번정도 먼 서울이 준 다음에 나중에 요 내가 네 자극을 살 촌지 론 똑같이 땀 도록 하겠습니다 그리고 입에 톡 박치 없는거 에 착 이다 되면 저는 이게 쪽도 가 들어가거든요 녹두가 들어가면 굉장히 이창성 기 들 만큼 뜨거운 품질을 중화시켜 역할이라고 굉장히 곳에 에요 어느 쪽이 노트르 이렇게 물에 담궈 놓고 이 껍질을 뺀 거지만 그래도 이런게 적 남아 있잖아요 그러면은 이 당금 모를 버리지 시고 있 앙금으로 받고 이렇게 비교시 하지만 이 껍질이 재 문의 잘 껍질 느껴져요 이렇게 쓰시면 됩니다 해주시면 양 이러지 그래 라고 패턴에서 탱고 들어가게 썼냐 이렇게 다 보면 이렇게 끝에 남 춰 이런 이거 버리시고 또 5 222  어때 그 있겠죠 이런 식으로 여러 보다 쉽게 이 크지 댓글입니다  tweet 먼저 긴 왜 닭 복 부분이라고 자 이것을 이 a 라서 막 막으세요 이렇게 이렇게 수용을 내면은 나가 지거든요 이렇게 여기 밥 임무는 바깥으로 나오잖아요 랄까 이렇게 막 받으시고 그 다음에 여기에다가 여러가지 것을 주께 채울 거예요 먼저 어 대추 1 그 다음에 아 많은 1 으 드시고 좀 아 녹도 라 작자들 계산기 되는 거거든요 여기 안 89로 정도만 채워야 대가 치울 년은 다울 한번 그렇기 때문에 너무 카페에 버리게 터져요 젖살 설치하신 분 정도 no.5 으 윽 땅 잡화는 좀  으  그 4 이빨 8 9  뭐 다음에 협박할 분들 9 크 테 릭 에 답을 되겠지만 요정도 에게 넉넉하지 줘 어느 정도 했을 때 내게 다 드셔야 되요 기억에 따라 더 넣어 볶아 놓으면 아래 탑 달 법도 잘 아니 뭐 이렇게 터져 나 팔 꾼다고 점이 바깥으로 닭이 바깥을 파파야 무좀 검에서 안했나 합니당 아 코에는 방법을 하겠습니다 아 앗 이렇게 참아야 되면은 한쪽 다리 요 뒤에다가 칼집을 살짝 욕심 돼요 여기에다가 너무 쉽게 말고 4 아 으 eie er 예 아 왜 그렇게 돼 있죠 으  그러면 좀 그렇겠죠 제겐 좀 이거를 김재기 리큐르 시고 그 망한 부분에 달을 이렇게 bit 를 넣으시고 또 아닌 논거를 위해 달아서 no note 열어주고 어떻게 해야 되겠네 5  저는 이 뚜껑 물에다가 2 삼계탕을 살짝 된 튀김 나라 나요 8 기름을 좀 빼서 여기다가 다시 삶을 텐데요 아무래도 이 껍데기 다 빼는 맛을 넣고 기름에 또 다른 께 다 들어가 실 찮 아 요 뭐 조 건물의  튀김 다 오르죠 대치면 m 기름이 좀 빠져요   으 캠플 묶은 끈은 것 보십시오  my  으 아까 여기 1개 컬러 물에다가 이것을 계속 유혹해서 드리겠습니다 나머지 또 한 디도 지막 하겠습니다 아 굉장히 듣기 가만히 그렇죠 이런 과정을 거치면 백수 깨진된 국물이 아주 깔끔하답니다   행운도 정적으로 말을 듣고 없고 으 생각만 으 약간 한쪽 좀 더워서 아 아래쪽 보험 그런 다음에 이렇게 뚜껑을 독과 30분 역을 안하겠습니다 으 한 5번정도 라 두꺼운 결국 우리 구요 30분에서 40분 정도로 뚜껑을 닫고 있게끔 흐려서 그렇게 친한 생각하게 됐습니다  다 무리 된것 같아요 네 차례야 깔게 부풀어 올라서 축문 착 다 잘 이익을 거거든요 음 클래스 당 2  no  소개팅 않음 되었대요 이렇게 대부분을 갈라 코바 올릴께요 그냥 물에다가 알면 국물이 훨씬 더 맛있었어요 꼭 떠 꿈은 적당히 이렇게 잘 맞춰서 뜻이 되고 요 고기는 소금의 나무 추락 이렇게 준비해서 찍어주시면 되겠습니다 참게탕 완성되었습니다 시청해 주장한다 미라 다운좀 제가 아름다운 봄 으 으 좀 되겠네 다비드가 이 자리 거잖아요 걸은 인플레 다가는 몸에 라가 계시면 좀 훨씬 더 바짝 알고 맛있습니다  으 no my eco
https://www.youtube.com/watch?v=VRPQetdPYiE,누가해도 맛있는 양배추 베이컨 볶음,won 법까지 생겼어요  w 입니다 으  too cool 으 이 양배추 열고 어떻게 베이컨 고장이 깨 카페 리카 려 해서 얼  약세 택 1 강이라 전 메이크업을 좋겠구요 5장 정도 개정 버리고 또 자전거 운영도 자극합니다 그런거 같아요 으 으 뜻입니다 편 반드시 좀 될건데 이타샤 보도록 내가 30000 쌍 상 아 통늘이 없애면 악 그냥 3 면에서 줄이면 은 이런게 좀 준비해 뜻이다 끄니까 너무 얇게 는 하셨구요 함정도 어떻게 이상으로 복구 짱입니다요 아 탁 탁 탁   장비에 쇼박스 안락사 이렇게 살펴보는데 섞어주시면 되요 좀 들어가는 재료가 간단해 간장 하고 이렇게 털처럼 아 그래 2 수로서 제가 이렇게 계속 요거 받으러 가요 모두 복귀 자 이렇게 가죽에서 문장으로 발아래 며 잖아요 4 l 5 4 입니다 10 배 팔 일단은 올리고 력에 씁니다 돌 부하 조수가 정도 넣으시고 9 아 여러편 만날수 있겠죠  으 합니다 4 빨래 다 펼쳐 올라요 캐릭터 4  co.kr 장난감 3 222 kl 심하게 떡까지 수 있겠어요 4 222 yet we 으 북한의 어느정도 볶아졌으면 그냥 택시를  ver 4  woo lee 이게 한번 정도 이거 시도하면 찾겠지 아 w 4 5    hoo hoo hoo woo  으 m5 으 으 5
https://www.youtube.com/watch?v=2WBrCDS2ZiQ,"트레이더스 족발 활용법 | 만능 겨자소스레시피 | 집에서 쉽게 만드는 새콤달콤한 겨자소스의 냉채족발 |  냉채족발 겨자 소스 황금레시피 | 손님상차림, 손님초대요리",으 하 게 저렇게 정말 고생하셨고 예  5 으  cool cool 5 으 으 col2 촉발 요구에 따라 웃을 켜야 촉발 애착 해보도록 하겠습니다 뭐 소스를 안 주도록 할 거에요 간장 식초 넣고  노려보다 이해  그 답에 또 김장 겨자 한심한 내내 법한 요법입니다 으 8  꿀 도착 좋겠네요 먹어 각 그건 약 초 공 은 뻔 할 곳이 정도 한번 배워보려고 하게 됩니다  충분히 이렇게 잘 저버리게 해서 백령 걸 말로 보관해 놓고 유격 에 들어갈 재료들을 준비 한번 더 사게 되자 들어가지를 간단한데 족발 도 답에 양파는 4 즉 내 음악까지 들어 제가 썰어서 얼굴에 당 알았어요 그리고 이해하고 작은 오해가 들어갈 거에요  오이는 이렇게 접시가 있더라구요 그래서 좀 준비 으 내가 곤란해 싫어져 잊겠지 그러다 쐬고 책 쌀 새로 할게요 합니다 으 으 으 5   배는 약간 토끼 있게 쓰시는게 좋을것 같았어요 좋겠어 뭐 4 아 으 예 2 저한테 파켓 먼저 축복받을 보시고 좀 소송 1단 정도 보소 살짝 간이 배 더라 다니게 소개좀 해 가시고  날짜  세팅 생각합 아시아 맥북에 잡아 보도록 하겠습니다 이 어떻다고 준비 했는데요 어디 아무렇게나 하시오 같이 주시면 생각합니다 으  으 으 4 lee 으 으 버무려 놓은 그 족발 내다가 나체로 다시 한번 더 멋 있도록 하겠습니다  으 아 아 아 222 556 or 답을 해야 됩니다 222 아 왜 봅니다 으   으 으 으 으 여름에 아주 상큼하게 드실 때는 국방대 겨자색 작아서 뵈었습니다 으 네놈 no 으
https://www.youtube.com/watch?v=FHMaVp1hwZg,"색을 예쁘게 내는 비법공개❤️ 단 4가지 재료로 쉽게 만드는 산적꼬치 | 보는재미&먹는재미 | 명절음식 | 잔치음식 | 잔치상 | 꼬치전 | 산적전 | 손님상차림, 손님초대요리",아 한글날 기획전 지켜 주도록 합니다  으  not cool 으 으 너는 추석 몇 11 데모 산적 꼬치전 할라고 해요 전후 주조로 때 많이 안 수업을 해요 소송이 됩니다 좀 날 표범을 만나야 이렇게 총 한번 해보겠습니다  산적 콜트 코기 300 허락을 중 됐어요 이 길이 든 음악 쌀 크게 맛지도 떨어 주실 것 같아요 참 아 be a  으 놈 no 이거  앞에도 기름기 없는 부탁해 싸지 나오 천사 를 이용하시면 좋아요  으 으 아 따 주세요 만으로 가듯이 되요 소고기 두께는 이렇게 보시면 좀 으 비슷하게 샬 거다 조금 더 크게 아쉽고 또 아직 혹이나 기르며 는 조금 추워 거든요 물론 이것도 없다 저랑 색깔 맞출려고 표 멋스러운 제 표 없으시면 뭐 새송이 느타리 아무말을 사용하셔도 되요 아무래도 이 그 툴 뜻 짧으니까 이번 벤치가 이런 내용 하시고 가운데 키우고 5 용도 크기에 딱 일 정도로 하시면 될 거에요 야차 같은거 좀 들어주세요 이런 방법은 2 고교 보다 조금 넓게 는 열심히 해양 어 으 으 흐 타고 들어갈 텐데 지금 내 파드 쌀 크기라 중에 맞추시면 되요   으 흰 부풀은 너무 재밌게 저 이건 좀 역장 한데 좀 큰 것들은 그 가운데 한번 갈라서 이렇게 되었고 이 파랑 거랑 치 키 대한 이렇게 색깔이 아주 알았거든요 그러지요 중대 주시고 예 꽂아 맡겨 볼게요 초고 싸 연희 특파원 특별한 양념을 안 하고 그냥 한테 고개를 째깍 해야 되잖아요 더모 끼니까 할게요 버터 초 뭐 미리 쓰다 기탁 곰 합니다  were  over  4 합니다 이렇게 산장이 관해 좀 심심 하면 안되고 간의 좀 된다고 할 정도로 가리 있게 하시고요 양 옆 에 들어간 오븐에 10분 6 n 도개교 시면 좋을것 같아요 너무 차기를 발전 되겠습니다  으 3 상 전기 w 으 tel 으 으 으 저는  요런식으로 색깔을 쳤는데 멍 능동  이렇게 그런 있는 잔 접고 있고 이 이두식 의료 일이 있는데 저희는 역 올래요 이쪽으로 만에 충분하게 있더라구요 아 먼저 꼭 이끼 신다 4 으 으  화석 5 으 와 쌀 빨간 부분 나오게 자 아무래 침대 부분에 맛있으니까 흰부분 단 강가나 되시고 색감 살려 해서 타라 놔라 지시나 색갈이 많거든요 더 부터 고기를 좋아해서 꼭 하나 더 더욱 더 이렇게 으 이런 식으로 으 으   결혼 물을 준비해야 하잖아요 으 탐 으 으 으 으 으 으 으 으 요금 루프 매는 결을 잘 찾아 봐야 좋을지 적 중지 각색을 내고 이런 퍼 를 이용할 심해지고 힘 점 타리타리 줘 아무래도 이게 깔끔 있잖아요 으 말걸 가위로 잘라주시면 되요 바닥에 쭉  으 이 가루는 저는 붙인 가로 변했네요 9 주가 되는 까지 제모 녹말 까도 되고 약간 여가 아니지 있었다 어 뭐지 거 같아요 항공 요건 행복하게 는 요기 모양이 좀 색깔이 살아있다 이쁘잖아요 그래서 으  색깔이 거 태가 살아 있어야 되기 때문에 이 뒤면에 람이 까를 아 묻힐 거예요 뒷면 말 이렇게 물까지 붙여서 이렇게 됐나 붙죠  아 님 음악 * 한문을 잘 빼 주셔야 되요 예 3 4 5  er  으 5 goode  으 4 그리고 아무래도 고개가 들어가 뜨니까 쿠르드 나가려는 휴진 어디까지 아니 있겠어 처음엔 5 뵙게 벌어지는가  첫 뵙기 4 4  이 따 채워지지 않는 가보 이를 바로 잡아 주시면 좋을것 같아요 좀 아 으 아 보기 물집이 안됩니다 봅니다  캘럼 또 집들이 너무 많이 따지게 됩니다 기차를 타고 내려 예 e 안되는 너무 안되 거지 my  차례 게임을 했어요 축하해주고 다 익을때까지 들어줬다 합니다 4 으 4 조금 끊어야지 날 굉장히 정말 들어 보이니까 시 적인 꽃이 적은 꼭 해보세요 추천이 최   4 으 222 아
